product_id,product_name,price,description,category
1,Task,380.99,Agree final how beyond just.,Electronics
2,Third,553.86,Exactly certainly Democrat.,Electronics
3,Professional,6.1,Exactly wish lay treatment.,Books
4,Pretty,806.97,Face several continue product.,Books
5,Official,424.17,Defense minute look remember line possible capital.,Electronics
6,Green,655.81,Control test course public talk hand.,Electronics
7,Fact,950.43,Doctor series week choice go natural enjoy.,Clothing
8,Defense,129.85,Time really science fine read.,Books
9,Bed,254.2,Beautiful build white ability mission rock.,Toys
10,Operation,488.05,Early factor American yourself instead.,Books
11,Out,733.38,Draw child cell picture life.,Books
12,Million,285.93,Positive event third involve thank situation third.,Books
13,Bit,640.22,Talk design alone set huge my.,Clothing
14,Stage,655.99,Responsibility quite again big cover clear.,Books
15,Respond,225.12,Source low try look.,Clothing
16,Before,203.98,Vote memory move ready simple election.,Toys
17,Personal,413.41,Factor church capital peace.,Books
18,Government,400.23,Media feeling wait avoid institution determine similar.,Home & Garden
19,Set,959.14,Official American he.,Toys
20,Compare,780.89,Place ready crime.,Home & Garden
21,Fast,788.64,See above guess data staff half over.,Toys
22,Congress,310.0,Give hope suddenly heart.,Clothing
23,Election,649.41,Movement against move trial shake sit population.,Home & Garden
24,Society,675.93,My catch tend candidate.,Books
25,Pressure,312.65,Than plant response technology draw.,Books
26,Less,43.79,Cost road somebody smile.,Toys
27,She,899.88,Exactly executive better country beyond door.,Electronics
28,Ball,842.92,Environmental before situation color.,Home & Garden
29,Say,319.06,Turn more feel goal amount cost.,Toys
30,Arm,572.68,Decision executive allow quite assume.,Electronics
31,National,659.26,Write receive degree order support news step.,Electronics
32,Well,354.14,Beat whose shake budget strong threat material picture.,Toys
33,Sport,780.13,Remember worker pressure remain property data picture.,Toys
34,At,925.48,Film describe billion share to at.,Toys
35,Forget,391.58,Cultural head very.,Home & Garden
36,Large,281.19,Success start probably evidence card discuss huge but.,Toys
37,Husband,131.88,Nation address statement campaign treatment when turn use.,Home & Garden
38,Seven,294.33,Control view minute Congress factor.,Electronics
39,Probably,753.98,Leave particular and win.,Clothing
40,Car,600.38,None political operation final.,Books
41,Option,742.44,Concern artist north analysis attention cold century.,Home & Garden
42,Top,469.1,Method home allow growth address.,Clothing
43,Table,215.03,Fight mean however political.,Books
44,Born,938.07,Build ask leg can class human.,Books
45,Air,1.94,Simple gas later think of.,Clothing
46,Past,365.5,Check often network result.,Clothing
47,Painting,90.71,Success man admit yes suggest whose responsibility.,Books
48,Western,300.92,Section down response case.,Toys
49,Education,932.47,Finish nearly partner I board body.,Clothing
50,Close,165.22,Just purpose heavy soon cultural fly charge.,Home & Garden
51,Book,247.73,Bring machine here must.,Electronics
52,Yourself,829.31,Large business improve toward.,Electronics
53,Question,303.85,Director day agreement painting expert question near.,Clothing
54,Generation,674.38,Exactly sell but focus tell red economy.,Books
55,Direction,41.32,East for name watch.,Electronics
56,Idea,631.72,Measure type need record partner so.,Clothing
57,Experience,392.62,Society rise religious executive tend section.,Clothing
58,Whole,570.93,Population inside second increase lawyer notice.,Electronics
59,Case,928.81,Fund peace five war season loss.,Books
60,See,65.38,Reduce wife peace his want have learn trouble.,Electronics
61,Foreign,188.88,End clearly truth.,Electronics
62,Together,664.73,Four daughter support population community use society purpose.,Clothing
63,Response,692.73,Worry like other rise think enough conference low.,Home & Garden
64,Study,298.57,Fact positive American notice.,Clothing
65,Central,714.7,Apply boy turn.,Toys
66,Most,990.89,Nearly out college career continue.,Electronics
67,Name,211.31,Foreign strategy minute indicate husband task.,Electronics
68,Language,525.56,Our against front center begin majority check movie.,Toys
69,College,79.02,Reality fact serious debate chair strong.,Electronics
70,Particularly,808.61,Article amount will yourself you field upon lawyer.,Clothing
71,Investment,575.67,Next long reflect year note.,Books
72,Eye,803.71,Behavior blue minute fire network.,Books
73,Magazine,766.55,Condition recently force weight fact meet.,Books
74,Have,503.63,The it manage whose position boy.,Home & Garden
75,At,454.92,Among next resource vote future democratic night expert.,Electronics
76,Want,725.38,Kitchen political daughter any both while.,Books
77,A,36.26,Himself begin because dream chair daughter argue.,Books
78,Decade,203.83,Personal old whose want herself view exist.,Books
79,Until,355.2,That leave rather talk seem.,Clothing
80,Teacher,184.29,Significant draw force size.,Electronics
81,Force,635.2,Nothing church really money foot report.,Home & Garden
82,Subject,12.38,Director hit prove speak total.,Clothing
83,News,339.13,Decade different any oil rather.,Books
84,Leg,829.84,Require early over moment yes in.,Home & Garden
85,Population,552.12,Probably hotel skin significant brother.,Electronics
86,While,583.22,Myself own vote suffer thus arrive.,Electronics
87,Remember,224.64,Film event well social me trip cup.,Books
88,Theory,698.39,Film anything size glass price environment.,Clothing
89,Someone,145.22,Wish city strong discussion.,Electronics
90,Economy,891.77,Structure travel issue anyone.,Clothing
91,List,672.37,Institution health day food left price agreement.,Home & Garden
92,Us,854.7,Long write change late view second in.,Clothing
93,Hotel,781.1,Pick break fact floor my future.,Home & Garden
94,Mention,460.26,Art should political prove value.,Books
95,Agree,551.85,Life need even join agent rest size.,Clothing
96,Ten,46.87,Create half manage officer.,Clothing
97,Mr,444.48,War talk item house.,Clothing
98,Surface,668.25,Debate bag six present.,Books
99,Black,356.71,High million along call claim.,Books
100,Care,495.04,Music hundred follow age test interest successful.,Home & Garden
